label,x_train
neutral,i got 2 classes then im off going back to Greensboro. im heading to NY tomorrow
neutral,"If you were into Blazblue , I had suggest Bang Shishigami ."
neutral,Gov. Mitch Daniels will announce his Indiana Supreme Court pick at 10 a.m. Will the 3rd time be the charm for a female member of the panel?
negative,I am going to steal your kitty and then all of your toys !
negative,Still tryna figure out why the hell Hot Jam is on a Monday...
neutral,Come check out the Montanari Bros East Coast Cup October 20th in New Haven CT! I will be there! I have some... http://t.co/pnyreXYK
positive,Awesome week coming up. Are you ready for some football ? Ravens v. Dream Team Thursday at 7:30 and Redskins v.... http://fb.me/FaXS5ntp
neutral,FM Preview: Derby County v Peterborough United 28 Apr 2012: FootyMad attempt to assist you with their form guide as... http://t.co/JS3xhWqI
neutral,"@Im_JoeGrizzly bro get that FAFSA done tomorrow, last day."
negative,@Andrew_Heaton I think we need 3 first XI ready players in January. That's a huge ask unless you're prepared to overpay
neutral,"After today's bet came in I'm feeling confident with tomorrow's bet: Ath Madrid, Juve, Napoli, Bayern Munich, Porto #comeon"
neutral,Don't forget that the exclusive screening of Skyfall takes place this Thursday at Cineplex Oasis Mall.Red Carpet... http://t.co/jM4M548Y
positive,"@mushroomdiary hi john im interviewing antonio carluccio tomorrow, what mushroom question will make a good one?x"
neutral,"US government proposes law making it illegal for them to kill you: Last Friday, US Congressman Dennis Kucinich i... http://t.co/dwHbVK1t"
positive,"Milano, Italy- tomorrow Mount snowdon, Wales- 10 days London New Years/bday-11 days  Bring it onnn"
neutral,@forcecast My video from Star Wars Weekends on Saturday: @dave_filoni Q&amp;A with host @HerUniverse http://t.co/jPkkMgVC #CloneWars Season 5
neutral,christmas was totally invented here .
positive,Lionel Messi picks up Golden Boot as top scorer: Barcelona striker Lionel Messi was presented Monday with his se... http://t.co/K0aYRiwL
neutral,"And I meant ghosts that just go around haunting houses and stuff , not spirits sent from God ."
neutral,Imaaa make moves tomorrow !
negative,Ron Jaworski said #12 is the 4th best rookie qb from this rookie class #WTH #wtf jaws is an idiot @JimIrsay @JMV1070
negative,Did you just tell me Lucas scott leaves in the 6th season of tree hill with peyton to travel the wolrd?#YOUJUSTRUINEDMYLIFE #FUCKYOU
neutral,"World Music Festival Rocks City Saturday: Maria Muldaur headlines the day-long event, which bring French G... http://t.co/7iBd9qL0 #jazz"
negative,Don't get me on the topic of Andrew Breitbart again. I cried like a child last Saturday.
neutral,"@Vinay_Kumar_R, part of the India 'A' playing XI, will be available for the Ranji Trophy opening fixture against Baroda starting tomorrow."
neutral,N.W: Unofficially Yours for the 5th time :))
positive,@Novomix30 good field for Paris-Nice. First sportive of season for me tomorrow so good weekend off and on the bike
neutral,Guy sat opposite me on the train is the spit of Dave Grohl
negative,@lazofficial How they gone kill u on da 1st episode of the new season of Breakout Kings? Damn no more eye candy. Miss you
negative,I have been getting depressed out of no where some days .
negative,"i spelled dongwoo's name as songwoo.. omg, who the hell is songwoo? the 8th infinite member???"
negative,Niggas be on the LAKERS DICK...we still gon finish damn near first seed...while yo team be struggling for the 8th spot
neutral,you know any good c programming websites ?
neutral,Watch lor. I saw a few swatch one i thk quite ok. Ard 116 but i need 2nd opinion leh...
positive,"Cant wait to see ""Flight"" on Saturday, Denzel is one of the best actors in the world alongside Leo and De Niro"
positive,"Went to see ""Rise of the Planet of the Apes"" tonight Great movie B+ for sure.  !!lChris-Rockz!!!"
positive,"I wish you are feeling much better now , RQ ."
neutral,Watch out for Nigeria @52 GEJ pre recorded speech tomorrow live from the tape via NTA. @omojuwa
neutral,"on my YM shit right now. just finished listening to I Am Not A Human Being. now going onto Pink Friday. after this, hello Careless World."
positive,"with the Wikileaks releases yesterday, it's only gonna help 3rd party candidates make an impact in the election."
neutral,we are sitting near the back door there..come find us hor
neutral,Boomerang will be on SNSD's 2nd JP album. Not sure if it is the Boomerang that was discarded by SM
neutral,"We are in search for Card Section Manager in Muscat, Oman. If interested you may APPLY @ http://t.co/jdhDKPUd"
neutral,Ok... Then r we meeting later?
positive,"And on top of it all, my horoscope is super positive and my coffee is SO DELICIOUS today. Hey, Wednesday. We can get along!"
positive,Do not miss the last photo in the eBay listing .
neutral,thinking about stepping out tomorrow too club bodi.... decision's to be made
positive,"Hey guys, guess what!? I'm back at The Lair on January 19th, it's going to be bigger and better!! Tickets go on sale next Friday! Xx"
negative,"If you are a family member, friend, or fan of Austin Rivers you may want to unfollow me. This is about to get ugly."
neutral,Pottstown and Pottsgrove School Districts CLOSED on Tuesday due to the hurricane.
neutral,@RAIDERS: The Raiders are on the field for their Tueday afternoon practice as they get ready to face Arizona Thursday night in Oakland.
positive,@Jared_Akins trying to do the same ha. But I've been good. Just waiting to be up in Auburn with y'all in January
neutral,"I was in the 5th grade taking ISTEP tests when #9/11 happened, doesn't seem like its been that long ago"
positive,well...hope they call me again
neutral,"RT @djlogansama: After Hours tonight - Jammin, Dimples, Durrty Skanx, Harry Shotta, Byron & Romo audio download: http://t.co/gV3p2wn&gt; BIG!"
positive,A university uniform in appreciating military veterans: He reunited after the game Saturday with Capt. Michael P... http://t.co/RbHZKRzb
neutral,I nv subscribe mms service leh. U workin rite can only meet aft work isit?
neutral,I think imma just go tomorrow cus Iona feel like being bothers AT ALL !
positive,Fuck everyone else #dexter is my friend tonight. Bring it season 4
positive,"Wow. Marcos had no VP during Martial Law, but Enrile is the 2nd most powerful man in the Philippines then."
neutral,A little CAK-Alcoa primer before tonight's State Farm Rivalry Thursday game.... http://t.co/DMTHpnsY
neutral,@andy_oconnor @erickjpressman I'm going to try to bring the @gothamgirls to Volstead on Sat.  What you guys doing tomorrow?
negative,"I don't give a Fuck though, it's all about #sockersweek #ChicagoMagicPSG Friday night Lights at Olympic Park"
neutral,"One name #Illini fans will recognize on tonight's box score for New Zealand is Kirk Penney, who played for Wisconsin from 2000-03."
negative,"Long day work, G37 meet, Marijuana March and Avengers. All sick nonetheless."
negative,Ghost Rider 2 is out on Monday. Ignore it.
negative,@sandralaville Sounds like April may know the person that has taken her but just hope we DON'T have another Tia Sharp case on our hands!!
neutral,The highest any human has ever gone. Keith Richards may have something to say about that. #redbullstratos
positive,"@NJHoranHugs Haha, I hardly knew about them and one day I was at her house and she sat me down and made me watch the Brit Awards with her :)"
neutral,ACT at HF tomorrow. But I need a calculator with programs. Who got one I can borrow!?
neutral,Ward 2 May Have Two Members on the DC State Board of Education http://t.co/6DsUHvgL
negative,Ghost Rider: Spirit of Vengeance was a lost cause. You had nowhere to go but up after the 1st movie. And then you decided to dig a hole...
positive,Impressed with Siri. Asked to set an alarm for tomorrow at 8 AM. She clarified whether tomorrow meant today since just after midnight.
neutral,Eli Manning hopes the Giants can uplift the spirits of the millions affected by Sandy in NY with their game against the Steelers on Sunday
positive,RT @marcohanna: @afairclub sold out tonight!! Charlie Sheen's Cake Party!! Marco Hanna Live with Dudu Sax !!!
negative,"I have Physics revision for tomorrow but merr, I'm going to fail anyway"
positive,"Russell Howard, then Cuckoo, then Celebrity Juice, then Family Guy, Thursday night is the best night for comedy"
neutral,"Tiffany, CNBLUE's Yonghwa and B2ST's Kikwang will MC for the SBS K-Pop Super Concert in America on Nov 10: http://t.co/S6l8lkmv"
neutral,Erm... you stay which area ar? cos she wana meet me 11am at tanah merah mrt station n she\u2019s bringing her laptop for testing.. juz see if u free anot...
neutral,Clearwire Investor Demands Sale of Spectrum: Sprint Nextel may have designs on the struggling cellphone network ... http://t.co/53yUH7Hv
neutral,Don't Forget The Classical Brit Awards At 10pm tonight for a Special appearance of the 25th anniversary Cast of Phantom for 26th Bday??
positive,"Siapin nih..Like A G6,That What Makes You Beautiful,Just Dance,Boom Boom Pow! Ready for the day after tomorrow"
neutral,@LiamToyStory30 in your bio you mention July 25th 2013 does that mean that you are going to the 1D concert at the Maverik Center like me?
neutral,Omg!!! Just saw on E News that Harry kissed Niall at the Texas concert on Sunday!! Fangirling!!!!
negative,I guess Knicks/Heat is on for now. Pretty clear that tomorrow's game wasn't going to happen.
positive,@indomienoodlez  May Allah grants us all our HRt desires n make us better prsns than the yrs before
neutral,"Ricky Ponting has passed 23,000 First Class runs - the 12th Australian to do so!"
negative,DTN Cricket: Pattinson may be saved for A tour ahead of Ashes: James Pattinson may not make it to the ODI tour o... http://t.co/9nt69Ifk
neutral,Call me when u finish then i come n pick u.
positive,Don't forget to get your self out to BettyVirginia Park tomorrow @ 10am for the Kickball Tournament! #IPittyTheFoolThatCantKickItOldSchool
neutral,The Clown has broken the record and become the 1st film to win 12 Brazilian Academy Awards yesterday. http://t.co/mbSGY3kt
positive,I am such a dork for this but my new FAVORITE show on VH1 is ... `` Scott Baio is 45 and Still Single '' .
neutral,Thursday nights just wont be the same without Waterloo Road
negative,The GOP's greatest crime? @pwire: Boehner proposes Obama speech be on the same night as NFL opening night...  http://t.co/aS8DBGS
positive,Thanksgiving leftovers is the 2nd BEST part of thanksgiving .. Why wouldn't i be mad
positive,Brilliant 85 mins for @naisy14 in the Mersey derby. Not a bad game for 1st goal....
neutral,Oct 9 1888 The Washington Monument officially opened to the general public. Have you been to visit?
positive,"SBS : Emails will start going out tomorrow. Thank you, everyone, for your patience!"
negative,Four Lions is a brilliant film but I think it may be a bit insensitive of Channel 4 to show it so close to 9/11...
positive,"Best of luck to @ArsenalLadies tonight, who have a big league game against Everton at Borehamwood. 7pm k.o."
neutral,Euro Parliament may freeze contacts with Duma until Russia holds free and fair elections   - Breaking News Buzz http://t.co/2POdgLyU
positive,Tomorrow is going to be a fun-filled day of emailing people on how and what to do so I can come back to Murray in the spring. #stressful
neutral,"GM FBF, let's go ole skool today...The Winans, the choices 1) Tomorrow 2) Uphold Me or 3) Bring Back The Days, the voting begins now!"
neutral,"Mizzou Links, 9-5-12: Holy smokes, it's Wednesday already? I haven't even posted Bill Carter's SELA photo... http://t.co/ldBya3wY #NCAAF"
negative,@TheAmazingSalah You're saying perseverance in all instances. That doesn't mean #OccupyAUC is equivalent to 25 Jan revolution. see the diff?
neutral,ya see ü soon... must really meet up!
positive,"@mite25  thanks for following me Maite,great to see you Saturday."
neutral,The RAIDERS game is tomorrow and I'm juiced. Who is going or wants to go to the game?
negative,stupid cable took the CW Network away why?it better be back by october 11th if not we are going to have a problem lol #tvd
neutral,"The MetLife blimp was flying over Starkville, MS today. Probably getting ready for the MSU game Saturday."
positive,"November: my birthday month, election day, a weekend in San Fran with @AdamRGarcia, Naples for Thanksgiving, lots of friends &amp; family. YES."
neutral,@VirginAmerica Friday flight JFK to LAX @9.15 AM. Is it still on? Will we get home?
negative,Blow to the Lions...Joel Patfull's out for the season after breaking his hand in Sunday's loss to Adelaide. Surgery Wed morn.  #afl
negative,@AnnaVonWinter Im sad I never saw you at Phoenix Comicon but I didnt spend much time in the exhibition hall after friday.
negative,I'm really sad I'm not going to able to celebrate the 100th Anniversary of the Montreal Canadiens for the 4th year in a row. #NHLLockout
positive,#jerzday tonight FIRST EPISODE OF JERSEY SHORE SEASON 4 PREMIERES TONIGHT!!!!! :')
neutral,@PJmonaghan7  HEY YOU. Go to the Carnival Tomorrow http://t.co/DirDuPa8
negative,The Lorax is one of the stupidest animated movies I've ever sat through. I wasted a nap for this?
negative,Sunday is turning out to be the day when i play Temple Run. Social life is a joke only. Forever alone lvl 100000000.
neutral,Ok lor... Go out walk walk then wun b fat... Hee... Then wat time ü wan to meet... Aft lunch?
neutral,"I'll be at Star Wars Weekends tomorrow, I'll be the guy in the Jack Skellington golf hat #StarWarsWeekends"
positive,"Monday's area sports briefs | North Myrtle Beach volleyball to play for Lower State title: ""I was pleased with t... http://t.co/dA8IiHts"
neutral,"Might have to go for a Plan B on my Halloween costume, unless the stars align tomorrow. WHY is Halloween on a Wed? #awkwardrushedplanning"
negative,I wish I was in Bolton tonight :(
negative,@DJmizuhara right! Where is the 2nd Vita heaven? Vita is a zombie right now. Maybe Sony is busy on the PS4 and just forgot about the Vita.
positive,Can't wait till Sunday morning when we (Shola) make the Mackems cry. Pretty sure a #HatemBomb or two will be dropped too. #PremierPunditry
positive,Looking forward to playing w/SF Contemporary Music Players tomorrow at Yerba Buena Center for the Arts! What a fantastic group of musicians!
negative,I don't like testing I'm glad I don't have to worry about the CASHEE anymore on may.8th (: passed that shxt !
positive,@Carolyn1202a Im glad you're having a good time in Cleveland sweetie! :) & awsome that u will watch Melodifestivalen with us tomorrow! Xo
neutral,100 days away: Barack Obama &amp; Mitt Romney meet in their first TV debate at the University of Denver (3 Oct)
neutral,Stone Brewing is mow just a stone's throw from the Del Mar station.  Welcome to Old Pas' http://t.co/FEzwlIp1
neutral,Anonymous asked: Just realized while watchin fri-end that the youtube account that uploaded the video is... http://t.co/ljUqkCaG
negative,"Alright, if my daughter keeps singing Avril just to annoy me, I may be forced to retaliate."
neutral,"@St_JamesTheatre The Ladykillers (which I first saw in London), Chicago (for about the 8th time) and Mrs Brown's Boys (tv recording)."
neutral,"Torre Calls for More Respect as Player Feuds Cross Line: On Saturday morning, Torre's iPad chimed with news of a... http://bit.ly/oEme0C"
positive,"@oomzee just realized i had 400 credits on my acc left, got one pack nothing in it but a free pack with it, di maria 2nd pack :)"
negative,Watching Ghost Rider: Spirit of Vengeance. It's much worse when you may have thought. #fb
positive,@TwoGlovesGolf awesome round and congrats on your 1st tour victory! Enjoy the Ritz Carlton and Kapalua Plantation course...you've earned it!
neutral,@em_fost 3rd floor ISAT on the roof you'll see it when you walk up the stairs its on the right
positive,@hensley_shana Awesome Photo of the snow starting in West Liberty! May we broadcast with credit to you? http://t.co/n8f43O2h
neutral,@MatthewBerryTMR Ryan Grant or Felix Jones in the 5th round!!!! HURRY!!! I already have Tony Romo and Dez so idk about FJtheres also steve j
positive,Just finished a great photo/video shoot for a Nuit Blanche fashion exhibit. It'll be on display at the Pantages hotel on October 1st.
neutral,"Battlefield 3, Open Lobby, 'Rats Clan' Xbox Live Server, Sunday 9:30pm GMT.  ...bring the rain."
negative,@xxxBiBiJones Sorry about the Yankees... there is always tomorrow.  Want to fly to New York for a game?
neutral,"Just back from fab visit to Floriade in Venlo. Chelsea Flower Show meets Eden Project! On til 7 Oct, otherwise you'll have to wait 10 years!"
positive,"Looking forward to the nest Prizefighter on Nov 3rd at Bethnal Green - Light Middleweights turn - 2k bonus added for each KO, #incentive"
neutral,#OPM will be performing live in the southside at Rex Theatre on the 8th of June. Holla at any #OPM rep. or myself for tickets.
neutral,have not you ever seen those ads for thin lizzy ?
positive,I love Tom Boonen. Forget the whole birth/citizen issue. I might just write him in for president in November.  http://t.co/9ry9OM13
positive,Interesting: More Tudou staff may follow chief out the door. http://t.co/9XbBJe8R
neutral,@SaraaDemiri it's Republic Day in Turkey. Like 4th July in USA.
neutral,"Now that Droid Bionic is finally ""official"" for 9/8, I'll just wait til Oct so I have something to compare it to. Vigor or Prime maybe?"
neutral,@louisck is hosting #SNL on Nov 3. It will be epic. Like if the ghosts of Gilda Radner&amp;John Belushi mated w/ Bill Murray &amp; had a comedy baby
positive,"@PacificaPatch This Friday night, Terra Nova football is playing one of our teams up here. I can do a little something for PP if you want."
neutral,@MrsCheddies mid-Feb at the moment. I'm hoping it arrives before Chinese New Year!
positive,@the_overtones Looks like you guys had fun in 'sunny' Scotland...looks as if there'll be some hungover'tones today... #hadto x
positive,"Gumby may be the answer to our forward woes. The Bomb Squad never stop believing, and we never stop believing in Gumby. #releasethegumby"
neutral,"The video of Porto ""Oportonity City"" won the 1st prize in category Cultural Tourism in ART&amp;TUR International Tourism Film Festival..."
neutral,Did I miss the Charlie Sheen roast on Comedy Central or is it Sept 19th?
negative,"@Jordilass you staying up for Monday's game. Don't fancy our chances with Krul, colo and Tiote missing"
positive,CME ~ Evidence suggests combo treatment may be the best option for DME. Posterior segment drug delivery is also key.  http://t.co/A0E5n4pG
negative,I got to piss like a Russian race horse in the Kentucky Derby with a glue trust stuck ahead of him and he in 4th place
negative,@Michael5SOS are you coming to nz tonight or tomorrow morning?? Waaa im so confused ):
neutral,@NASCARchickie See now U can tell the South about a Gin Mill. 1st on your block lol
neutral,I'm bout to just listen to nicki minaj all night
neutral,http://t.co/77CAjSFD Today's Al-ien #Nascar Person of the Day is Friday Hassler- died in a crash  1st Daytona 500 qualifying race in 72
positive,@_TruelyFavored Thank you and improud of you to gettin that OGT done.! and im gone come in December.! We still  making that trip to church!?
neutral,this week is ` mittens and mai-tais ' that is in pasadena on Sunday night .
positive,Monday is a Moon Day!  Enjoy a sleep-in tomorrow &amp; a little extra rest.  Come to the Workshop with Harmony Lichty... http://t.co/tvkXm886
negative,@jtrojnar227 @gdisano55 that may lower his rank in the mcgeezers he will go down to the D league
neutral,Cowboys tonight to see eli young band ;)
neutral,Super bummed to find out that WPPI is the same time as our kids' spring break. Why is it in March this time?! @RFWPPI #fb
neutral,@TakaFlocka_ all I'm saying is we're playing 4 June not nov/dec. getting the kinks out now cuz come June well be there mini Lin
neutral,"1st Journey to the Center of the Earth, 2nd Journey to the Mysterious Island, and the 3rd??? Journey from the Earth to the Moon :))"
positive,"If Dontari Poe runs the 40 .3 slower at the NFL Combine, he's maybe a 2nd round pick. Nice work #Chiefs."
negative,Once again Democrats spent all night and this morning trying to talk down the stock market...whatever happens there can be no blank check!
neutral,#nowplaying Jim White - Crash Into the Sun http://t.co/H8AfTJm2
negative,Paiseh I check newsPaper 2day no tt show? 2day is WwF? dunno y no more liao. Maybe last wk last episode w Friends? I dunno? Sorry.
neutral,James Martin makes flowerpot bread on Sat Kitchen did he steal the idea from @firehousebread ??
neutral,@kristielupus try your third year in a place equilavilent to Leeds festival toilets on the Sunday.
neutral,US football down 7-3 at Chardon tonight after 1st Q
neutral,"Re. Mik, Ram, Lu &amp; C Dog, used to work with a few lads with Eng as 2nd lang, was very nearly major incident over a simple misinterpretation"
positive,@TimmyHillRacer Good luck in the NNS race tomorrow! I'll be cheering you on as always!! :)
positive,@tfrox @LynseyMc_Donald making them is awesome but on a lazy Sunday it is best left to Antonio Carluccio plus I can't get them sticky inside
neutral,Miss Teen USA on the next one.. Saturday Wahhh?(:
positive,And the kitchen really is not bad right now .
positive,International Women's Day which fall on 8 March made an international author shared tips to all the women on what makes French women so good
positive,After a truly amazing &amp; blessed 1st day @Athariyyah London Conference we are soon to embark upon Day 2!!Come &amp; take time out to learn truth
neutral,@stephyyboo15 Lol. Maybe Friday since I'm going to Georgetown.
neutral,@Marvi_Memon1 was the  employee of General Musharraf....Sheikh Rashid in Kamran Shahid's Front Line on April 17
neutral,Eimear Mullan is still in 2nd spot as the marathon starts in Ironman Wales.
positive,"@RediTlhabi @StevenB7777 OCTOBER  people have principles..&amp; argue passionately for them, about them &amp; ACT on them.  Ghandi, Sadat, ADT, me!"
positive,Thanks to all who came down to Mardis Gras in July at the Fullerton Downtown Plaza last night. All proceeds went... http://t.co/62uOiY2E
negative,At least the movie is still awesome :D Although I hate it when they change the name of films lol .
positive,"Taking some Enchanted , will credit !"
neutral,Too many people at my house my relatives are here as well besides the china people
neutral,"Laura Wright, Gareth Malone, Noah Stewart and Margherita Taylor attend the Classic BRIT Awards launch, September 6"
positive,Great Photo exhibition: Everything Was Moving: Photography from the 60s and 70s / untill 13 Jan 2013 Barbican Centre http://t.co/HzYOriit
positive,TY for making me a woman!!!! @EstelleDarlings said at constitution hall Saturday dont EVER EVER EVER EVER let someone make u feel like shit
neutral,Chris Rene: Live &amp; Exclusive!: X Factor may be about to start up its first live show of the s... http://t.co/8IdUDOfG #celebrity #gossip
positive,"James Murphy may b right-If pretentiousness leads to reading great books/listening to great music, even just to impress-you pry win in end"
neutral,@ilseabenavides October 13! Duelo is going!
positive,"Tomorrow, Okami will be released on PSN in HD. Can't wait to play it again! To me, it's one of the greatest games ever made! #okami #clover"
positive,"@ohohmario Why you so gwapo  ^_^ Take Care Mario,going to watch Suddenly it's Magic on Tuesday. :)"
neutral,"If you want to see an exciting finish to the 2005 UT at Bama game, check out CSS right now. 4th quarter 3-3."
negative,Ok Dongwoo's fansite is not accepting new members right now...need to register on the 11th
neutral,Jungle Island says it will be open as usual on Monday. To see what's open &amp; what's closed click on this link #IsaacOn6 http://t.co/DznGJ7EB
positive,Your ` idiosyncratic ' photos are beautiful by the way .
negative,Nothing says 'Fuck you' to Super Rugby than when EP Kings get relegated tomorrow. I'm waiting
negative,"It's a Monday, I'm in Muskoka, yet I'm not going to The Kee for Resort Night. What the fuck is happening?"
positive,hi\u002c how is your mother and the operation\u002c hope all is well. pls send my regards
neutral,Kevin Rudd rents out Canberra mansion and lives it up at Hyatt - Herald Sun: Kevin Rudd rents out Canberra mansi... http://t.co/dF49mDCB
positive,"Good to see real progress on the cleanup and rebuilding in Henryville, IN from the March 2nd tornado. http://t.co/ruvnrSck"
neutral,@NikCamelia cian an..huhuhu.... mybe tomorrow going to putrajaya..
positive,Scorcher Fest returns to the Duke again for a huge day of LIVE music! This years RECORD 180 ACTS! Sunday 18th... http://t.co/2v3yA4XN
neutral,Woods Sputters In Third Round At Bridgestone: Tiger Woods slipped further down the leaderboard Saturday after ca... http://bit.ly/qIPR1d
neutral,"Golf lessons will be available with Gary at Bearsden golf range from next Thursday,5pm onwards. Call the shop to book your lesson."
neutral,"This Saturday, Cherry Moon will burst with some RAW beatzzz from the masters. You like it RAW??? http://t.co/NlzcWw2Y"
neutral,"On Thursday night, White Arrows, Hindu Pirates and Group Love entertained the crowds who showed up on the sand a... http://t.co/I8OT6DS1"
positive,@JacqDowling @CougFanTMB I finished 1st in a Bowling 101 class of 50 that included members of the Bowling team... You're totally effed.. :D
neutral,"Go try and win a PS Vita at the Lollipop Chainsaw Event at Fish &amp; Co. @ Glasshouse. You may get bitten by zombies, but it's a PS Vita!"
neutral,@oitslauren hey since you asked me yesterday this is what the king looks like aka Anderson Silva aka 'The Spider' http://t.co/AuwSKbO
positive,Tomorrow is the day we'll beat justin biebers vevo record and earn our title back! :) :)
