label,x_train
neutral,Good morning. Just now went 2 celebrate my granny bday. Her bday on Tue\u002c but noone free on e actual day\u002c so? Came home then slept until now? Anyway met my..
positive,This time tomorrow night ill be partying it up in chapel hill :) #cantwait
neutral,Im cuming back to Natchitoches Friday just to Vote
neutral,Hai. One less option for me. So will you be there for long?
neutral,@SupremeJuice_ go to the bell game tomorrow I'll take you for. A littlle whippa
positive,:D I intend to be one someday .
positive,Valentine's just keeps getting better for me. Saw the trailer to MY SUPER PSYCHO SWEET 16 PART 3 and it airs on MTV March 13th! YESS!!!
negative,"Parker, Leonard steal OKC's thunder: Ninety minutes before tipoff Thursday night at the AT&amp;T Center, Oklahoma Ci... http://t.co/NNjbPSWk"
positive,@HarrisStyle00 going holiday eh ? HAHA going to Melaka tomorrow :)
positive,:> I am pretty sure I have been there ..
neutral,"Springsteen, Bon Jovi, Sting to Star in Hurricane Benefit Concert Friday:  Superstar musicians born in the New Y... http://t.co/VFYM2xOU"
neutral,"Dethklok, All That Remains, Machine Head, and The Black Dahlia Murder at Stage AE November 8th..HIGHLY considering going to that.#heavymetal"
neutral,Which poly she goin to... But u stayin in hostel so half e time u will b so far away mah... Haha\u002c wana c how her bf look lk...
negative,Bolton Wanderers have sacked manager Owen Coyle following a poor start to the season. The club currently sit in 18th in the Championship.
positive,whos trying to go to Buenos Aires with me February 23rd? Armin van Buuren &amp; Carl Cox! ...how does it get better?!
positive,A new favorite: Jason Vernau Live @ SurfComber March 16 th 2012 Miami WMC Pool Party with Robbie Rivera &amp; Friends http://t.co/ruEaugHY
neutral,@niyishandle tweet b4 d chat so it's all gud just wanted to find out if u will be in Abj jan/feb
negative,@Sean_Bridge no don't! I have to fit into a Tomb Raider costume next Wednesday! Save it for the #cakecrawl!
neutral,Seabuiscuit just ran by.. must be warming up for the Kentucky Derby  tomorrow... we need to set fire to Adele right meow @vickandreakos
positive,"Cabaret at Warners tonight, then a matinee show at Eastbourne tomorrow. Wednesday, off to the Kings Theatre, Southsea. Have a happy week..."
positive,@LeighFrancis: Celebrity Juice tonight 10pm itv2. Hurrraaaaah! its a Back to school special who's featuring ! The wait is too much ! Ooosh
neutral,RT @JohnInToronto: Former NHL'er Pavol Demitra among the 44 dead in the Russian plane crash earlier today.
neutral,"1st capital Canada Day, 12 hour telling of the Odyssey, Beirut and Mastodon at Bluesfest, craft brewery tour #WhatDidYouDoThisSummer"
positive,Sometimes you just got to put the Michael Jackson song from Free Willy on repeat all morning.
positive,All seniors will be recognized at FCA tomorrow and the first 25 will get free chickfila coupons for free biscuits! See y'all there :)
negative,@XD0290 the zombies would have been worse- the ad for Walking Dead S2 was playing all night during Family Guy. Creeps me the fuck out!
positive,Don't worry edmonton tomorrow morning your main streets will be clear and ready for you to drive on !!!! I better go to Bed
positive,Reminder- We hope to see you tomorrow night at Volstead! details on our FB page at https://t.co/Cj5uQD12
neutral,#WorldNews Sales of E L James' much talked about Fifty Shades of Grey trilogy fall for the first time in two mon... http://t.co/T1NwTrtb
neutral,did you know we are cropping with tammy on Friday night? $10 holds your spot! Patti is making her King cake again... http://t.co/QE0mrkVL
positive,I'm just looking forward to the Knicks verse Nets game on Thursday! Carmelo Anthony verse Deron Williams my two favorite players!
negative,@buckbelue8 why do you think Murray may leave? No way a team drafts him before the 5th or 6th round!
neutral,[NEWS] Stuck-Up Sunday: Shepard Fairey - Andre the Giant Uncut Sticker Sheet - @ObeyGiant @StuckUpPieceOf http://t.co/wpCHDDL4
positive,New Skyfall Trailer is Live. - *fans self* Is it October yet? I have ALL THE FEELS for this. Goddamn. http://t.co/rdabINzI
positive,"tent-owners should be asked , it is the right thing to do !"
neutral,@Doosh5 can u tweet me updates from the Warriors game tomorrow?
positive,FRIDAY NIGHT LIGHTS!!! Here in Brownsville the match between Hanna Eagels and Rivera Raiders.
neutral,"Review : black friday 2012 Como Stylish White Cat Shaped Watch with Key Chain Clip:  Find, shop, See Reviews , b... http://t.co/5FFpZ4Na"
negative,@RFelich if you're tryna go north on Iowa there's a bad accident down by 6th street...
negative,"No sir, I am not about to get on SPC for hiring Young Eli to go out there and entertain them white folks on a Monday night"
positive,I can't wait till my show in Elizabeth at club paradise on Saturday ima be wavy and turnt the fuck up!
neutral,"I posted 23 photos on Facebook in the album ""Abbey Dawn at New York Fashion Week - Backstage (10 Sep 2012)"" http://t.co/Elv45btJ"
neutral,was sat watching Degrassi then came to the realisation that Little Things will be aired in a while.
neutral,"How about the @DetroitLionsNFL gettin some recognition 10/10/2011 the Lions play on ""Monday night Football"""
positive,"@Martynshaw when mccann got our 3rd goal ian Bennett turned and winked to us posh fans, he loved it #trueposh"
positive,"studying anatomy &amp; watching Army Wives is what the rest of my night consist of, can't wait for a little break with @MaryBWelch tomorrow!"
negative,"It is not especially fulfilling work , but might fill the gap until you find something in Games ."
neutral,The Graduate @_mslee_ and Janee no wait Renee or Danee or was it Shanee no it may be Lanee *shrugs* http://t.co/QjcqqHdT
neutral,"@vincefoss According to reporters on the scene at practice, Lions rookie RB Mikel Leshoure was carted off field today with a left leg injury"
negative,I not free today i haf 2 pick my parents up tonite...
positive,Manuel Charr Looks Confident Ahead of Saturday Clash Vs. Vitali Klitschko: Charr didn't look scared as he stared... http://t.co/o3VxixpV
negative,League? RT @JovinhoMorales: I just found that Barcelona and Real Madrid are playing on Sunday... I need sleeping pills...
negative,WRITER #MOTIVATION: Dr. Seuss's 1st book was rejected by 43 publishers before it was accepted by the Vanguard Press. Don't give up
negative,"THEREFORE , you should not go at all ."
positive,son if deandre learned anything more than dunking.he could be the 3rd best center in the league. brook lopez's rebound numbers hold him back
positive,@andrewsikora The Tigers know it's a big game as well: resting Martinez & Alburquerque Monday and bumping Verlander.
neutral,"Managed to snag a RIH test press along with the new 7"". Woop. Come see them in Margate this Sunday"
neutral,Get down to Adelaide Oval tomorrow to see ACC's @frankyworrall and the @WestEndRedbacks in action!
negative,My random rant of the night:Lady Gaga being considered a fashion icon!Who in their right mind considers that fashion?She dresses in trash.
negative,@_Brendonsmall The tour dates got updated! Fox Theatre on the 24th or the 26th? I don't want to fuck this up.
neutral,Members: we will be helping at the polls tomorrow and Saturday as greeters. If interested we are working at Garner until 7 tomorrow
negative,People talkin shit just wait I'll be in Huntsville tomorrow !! Let me see you !!
positive,"she call me baby, I call her bae, sorry 4 the wait, Carter IV on the way! august 29th. hellllll yeahhh! (;"
neutral,You may have heard Threshold's media comments about banks seeking rent directly from tenants. Please contact us for advice if it affects you
positive,"My saturday just got BETTER, BRIGHTER and BOLDER."
neutral,"Photoset: jeremyrennerseyes: Jeremy Renner at the 22nd Annual Film Independent Spirit Awards, Santa Monica... http://t.co/7HFvwIkz"
negative,"RT @gatorgirl277: @DrDrewHLN  Conrad Murray claims MJ was unable to ""sleep"" the entire morning yet Murray was on his phone all AM--does  ..."
negative,@TRX450R I'm not sure I'm going to Brownsville tomorrow
neutral,Buzzer beater jump shot by Parker. On a primetime Thursday game...NO WAY that CAN happen! How great is the NBA?!?!
neutral,"Lmaooo""@hoodiesNhoneys: last time i hit a girl was 4th grade. i punched her in the nose for pinching me on st. patrick's day lmaoo"""
neutral,"watched Unofficially Yours with Richard Mark Morcella, his partner and Jaja Abastillas"
positive,"Looking forward to ring in the new school year @uncsangam for Aladdin...UNC Memorial Hall, Sat Aug 27th 6:30"
neutral,"Pictures of the day: 18 October 2012: A playful Amazon river dolphin, Usain Bolt's shoes and Mick Jagger. http://t.co/3n3hn7l8 #photography"
neutral,@BrittanyAnnMMA update me on Shores when u get the chance. BTW- I finished 5th in Japan open weight.
neutral,"What I plan on eating tomorrow at the @kystatefair ... Deep fried Kool-Aid, Deep fried Derby Pie, Deep fried Girl Scout Thin Mints, etc..."
neutral,"Thursday Night Football Open Thread - Buccaneers vs. Vikings: Tonight, the Tampa Bay Buccaneers will take on the... http://t.co/RIPETXV5"
positive,The audio booth is ready to blow the roof off the Comcast Center tomorrow! Are you? #MDMadness http://t.co/B19fECgY
neutral,michael jackson - hollywood tonight http://t.co/s6n3HJj
positive,"Shit, yeah, it's Thursday, Russell Howards Good News and Celebrity Juice is on"
positive,Photo: Good Monday Morning and Happy World Book Day! :3 (Taken with instagram) http://t.co/t3qmX4Kk
neutral,Tampa Bay Buccaneers: Game-by-Game Predictions for 2nd Half of the Season - Bleacher Report http://t.co/oHPjlwbY
neutral,Sat waiting for the bus trying to beat my high score on Temple Run #justbecause
positive,"@Cwell2strong4u  You sound like Will Ferrell on Old School. "" Got a big day tomorrow""! #soundsexciting #classic"
positive,"Hopefully, Summersville or somewhere tomorrow with my girls. Or something. @ChelsieSanson @paige_clevenger"
neutral,"Jesse Jackson, in #gso, says he's headed to Sanford fla, where Trayvon Martin was killed, Saturday night."
negative,"RT @linka01: Hey #GOP, no matter how you slam Obama, you own our credit rating downgrade. It is ALL your fault, & we'll remind you in No ..."
neutral,Bashaara Graves had 17 points and 15 rebounds in her debut with Tennessee in an exhibition game on Thursday. She played 23 minutes.
positive,"Project X is the best film ever made and someone with money needs to have one, like this Friday. #makeithappen"
neutral,"Book Swap, Saturday at 2pm! We'll bring the cookies...."
neutral,Billy Crystal attends the special 25th Anniversary Screening of 'The Princess Bride' at the New York Festival http://t.co/5juFdoBK
positive,"@d0ctorwho_ aww the Capitol haha, I'm ((finally)) going there in April (:"
neutral,Queen's Brian May says Freddie Mercury Biopic is on the way. Sacha Baron Cohen will play the role of Mercury. http://t.co/gn1pRFyt via @nme
negative,Shit's going down this Sat. at Neighborhood Theatre #DROP!THARD
neutral,"I'm going to Roger Sanchez at Dot Club in Santiago, Chile - Oct 31 http://t.co/YIjOkob7"
positive,Another day of ISS tomorrow. It won't even that bad.
positive,"Had a little trip out to the old town of Albuquerque, could easily be Mexico or Spain! Off to Vegas 2moz should get there Monday morning!"
positive,Looking forward to going to the Colts game this evening!
positive,That last tweet was to HF thanks for the day off tomorrow!! notttt
positive,@Real_Liam_Payne Saturday I buy my ticket for the #TMHTOUR in Belgium! I'm so happy! :)
negative,"@MyBeautyisBrown LMFAO his big ass get on my nerves, you going to class tomorrow?"
neutral,"About to watch Kony 2012 video. Despite 100m views, there are quite a number here watching for 1st time. Interested in the reactions.#yuga"
positive,"Tom Brady has been named AFC Offensive Player of the Week for the 22nd time, bringing him back up even with Peyton Manning for most ever."
neutral,"Reggie Wayne has run 64.1% of his routes from the slot. He has 45 targets on those routes, 3rd most in the league."
neutral,Can also but lunch will only b ready at 1 smth 2... U hungry?
neutral,"FB: Warriors fans can pick up the 3rd quarter of ESU's 35-28 win vs West Chester (Oct 6) right now on ROOT Sports (DIRECTV 659, DISH 428)"
neutral,"Wonder how long it will take to find out who won the 5th seat in Brindabella, and who the Chief Minister will be? #actvotes"
neutral,"My #MUFC XI for Super Sunday: De Gea, Rafa, Rio, Evans, Evra, Clevz, Nani, Young, Roo, Chicha, RVP. What about you?"
positive,BRIEF-Clearwire says has enough funding to last it until end Q3 2013: Oct 25 (Reuters) - Clearwire Corp :  * Say... http://t.co/TEvQt5d5
positive,ProudOfAllstar? Fuck yeah. Let's get it trending worldwide just like we got Allstar Weekend trending worldwide tonight!(:
positive,Happy 17th to HRT! We love you!!! @ Shan &amp; T-Bone's http://t.co/NSmZQTnI
negative,"He going to the fair , on Saturday &amp; I'm going to be out of town ! Mann BULLSHIT"
neutral,"The sale of the season hosted by Lucky Magazine with Grammy winner Jennifer Hudson, starts November 1st at 82Mercer http://t.co/RbKNjCbC"
neutral,"Got your tickets? Christmas Stories Tour with @jasongraymusic @KyleTMANMusic Nov 29, Hot Springs, Ar, Crossgate Church! Tickets at @itickets"
negative,If you call me 'Good Girl' one more time you may find my scolding hot coffee heading towards your crotchal region.
neutral,"So, the rumoured #LFC team was right, &amp; Gerrard, Agger, &amp; Suarez, all play. Big gamble by Rodgers with Everton on Sunday."
positive,"On this night of fine footy finals for the NRL &amp; AFL, may I take a moment to say the first round of Super rugby is only 148 sleeps away :)"
positive,@Astrochologist anything. I wondered how the aspects btwn my sun/moon faired with my rising. I also have Venus in Sag...yea lol Thank u :)
positive,"I missed the 10th birthday of Avril Lavigne's Sk8er Boi! Darn, I love that song, especially the part where she rhymes boy with boy. #Classic"
positive,@JackAllTimeLow can't wait for @AllTimeLow to hit up AZ on Sunday! Let the debauchery begin!
positive,watching Kung Fu Panda 2 with the tribe & the nieces...a mellow evening
neutral,Participate in the new @maiteoficial contest. Winner gets a special gift from Maite. Deadline is November 15 http://t.co/vidER6jg
positive,"@DeeDs9219 going to Florida with the fam, I'ma be back Tuesday tho. don't trash the room up too much! lol."
positive,Nadal at the Parc des Princes this Saturday!: Big news! Rafael Nadal accepted the invitation of Paris Saint-Germ... http://t.co/Jp6KH4Ul
neutral,"@patrick_amstrel 8/8  account using your BB device, you may want to follow @BlackBerryHelp for updates and additional support from RIM."
neutral,"Discover the Business Value of Your Library Card Wednesday, September 19th 1:00 pm - 3:00 pm Harold Washington... http://t.co/jAyQ4vnK"
neutral,Hmmm... I thk it\u2019s not bad la... I dun mind tpy lor...
neutral,Malkin playing Thursday: QuotePenguins center Evgeni Malkin is set to play his first game of the season ... http://t.co/7WzXZCVd #Hockey
positive,1. Noel Fielding comedy gala tonight :) 2. Work all day tomorrow 3. Granny Smith festival that night
positive,@LaurenKTJones that's awesome! Wanna go to the Albion v arsenal game at the emirates on the 8th of dec?? Would be cool to hang out..
positive,"@KuroiDaiyamondo I recognized Bomi cause she's my 2nd fav... &lt;3 btw, if I'll ever marry Hoya, i'll buy him a YoonJae dog... *.*"
neutral,"Hommage to Gary Carter and the Expos Day tomorrow at RCup: dollar hot dogs, and $8 tix at the 300 level. #Youppiwillbehere"
neutral,"Me: ""Pi day is March 14th, you know because Pi is 3.14"" @Samyoo: ""Oh yeah...I was thinking of 411""."
neutral,Knowing I can stay up all night coz its saturday and I can sleep in on Sunday just makes me sleepier on Sat nights
positive,So glad I walked past the Girl Scout table today. It's a much better Saturday knowing I'm one box of Thin Mints richer.
positive,"Just met with CJ, banjo player in @MatrimonyBand! Come out to Neighborhood Theatre on June 23rd for the concert! You won't want to miss it!!"
negative,RT @TelegraphSport: Gavin Henson looks set to miss the Rugby World Cup after dislocating a bone in his right wrist yesterday
positive,PlayStation Network maintenance scheduled for October 15 http://t.co/P9jkuYJ9 That'll be the new store then. Exciting!
positive,Big congrats goes out to Tampa Bay Damage for 2nd Place at Cup and 2nd Place overall in the Paintball Sports... http://t.co/98Z4v3zW
positive,@SuperSkin1 after tonight Colts fans are going to say Manning is John Beck like.
negative,"And just to annoy you , here 's the quote of the day : `` Time to put the mental in judgemental ! ''"
positive,Yay !!!!RT @kellymonaco1: Excited to interview the new cast of DWTS tonight for E News! They have no idea what their in for ;)
neutral,"Nascar Daytona 500 New Journal Complete Feb 19, 1978 Newspaper from the Daytona 500 Race http://t.co/UiizopGu #eBay"
negative,Why can I not work laying down ?
positive,"Buzzing for the game tomorrow, gong to be a great atmosphere and a possible upset is on the cards! Bring on Aston Villa! #stfc"
neutral,"Nine Goa Congress legislators want to join us: BJP: Panaji, Oct 31 (IANS) Goa's ruling Bharatiya Janata Party (B... http://t.co/YRYQMUcr"
positive,"@SeldomSeenGirl Everyone's still at Roskilde festival, it doesn't finish until tomorrow night, but just wait 'til Monday ;D"
positive,"RT""@3gerardpique: Great win 2-0 against America to end the USA tour! Now, it's time to play against Italy on wednesday with Spain! #tourfcb"""
neutral,"ha!RT @amNewYork: After a weekend of subway mayhem, the MTA expects service to return to normal for your morning commute http://t.co/Xaw29WA"
positive,"The Lorax paid us a surprise visit, checking the place out for Saturday. Come meet him 11/3 from 10-2! http://t.co/JJIicH4D"
negative,"The Bucks' John Henson is hit at the knee by a falling Ilyasova. Doesn't look good. He goes to the locker room. Bulls up 85-75, end of 3rd."
neutral,SUPPORTERS BUS TO DERRY: St Patrick's Athletic travel to the Brandywell on Friday for their last away match of t... http://t.co/GxoqNqmT
positive,"@Cole__Hines @WSJ @carney Print ain't dead yet Cole, and I'm sure you know there's something special about Sunday Papers too."
positive,"Last night was first rehearsal for the new rpoduction , very promising ."
neutral,"Help me smart peeps:  I need to get from the city to Alsip, back to the city on a Friday night.  Cheapest way to go? (it's for a wedding)"
negative,@ChicagoBears can not let be a let down game Sunday with Houston and San Fran coming up. Gotta focus on beating Tennessee. #JayisourQB
positive,Mail in a lather over C4's scheduling of Four Lions to coincide with 10th anniversary of 9/11. Too good a film for stunt scheduling I think.
neutral,"HARAKAH: Iran army monitoring all ships in Gulf: TEHRAN, Oct 28: A senior commander of the Islamic Revolution Gu... http://t.co/hbdrQP3P"
positive,@LouRoberg hey Lou I got a good deal on a bunker I can sell you on Nov 7th  #rightwingparanoia
positive,"@ernasty49 Great season, it's been a pleasure listening to Volare in the 9th inning! Mas Ernasty ano q viene!"
neutral,Hmmm... Thk d lor\u002c biscuit... Although i dunno wat kind of biscuit is tt... Never hear b4...
negative,@OriginalKingD: So you want people like Chief Keef &amp; Ted Nugent to have guns. c'mon son #debate
neutral,"@AlluringMBeauty {Ari heard Circe's giggle and sat up in her hammock} Er, anybody there? {She called out, scanning the shore line of the--"
positive,@CherylCole i love you! #thatisall its me Camilla Parker Bowles remember? Lol see you Monday i hope! *fingers crossed* xxxx
negative,"At the hotel room in Dannok, Thailand... So tired for a long trip last Friday night and shopping at Hat Yai yesterday...!!!"
positive,@ToyceMonique I know! Im still in Alabama but Ill be back soon. Next thursday Ill be featured at Bakers so you gotta come through!
neutral,RUMOR: #Blackhawks may have traded Niklas Hjalmarsson to the #Oilers for Sam Gagner. Stay tuned.
positive,As we patiently awaitRT @RealBlackCoffee: Back in Studio putting final touches to the #Album...should be out nxt week Friday.
neutral,"http://t.co/Zp19hXd7 - Have you heard of the ""39 steps""? A sneak peak of the National Award winning play. This Saturday at Music Academy!"
neutral,Ericsson T610... Haha u decide to get one too?
neutral,"LVMS prepares for NASCAR weekend, busy schedule of racing: By Mark Anderson NASCAR weekend will garner just abou... http://t.co/iWzWzMa1"
positive,"@skysportsnews I would love the audio book 'The Art Of War' by Sun Tzu, as read by Jim White!! #MountainsAndSea"
positive,This weekend Daylight Saving Time ends. Be sure to  set your clocks BACK one hour before going to bed on Saturday night.
neutral,This song says everything about a break up ...Rope To Hang by Neil McSweeney: Dir. Sat Johal of Crows Nest Films http://t.co/sA8mXUJv
negative,"@Daggy1 obama's goal is to lead us into 3rd world status, so you're absolutely right, ""obama doesn't care"""
positive,Beautiful sunrise at the Washington Monument taken by @abpanphoto - http://t.co/bga98Srw
positive,@thatkid193 im a JR Smith fan hes super athletic so i kind of want him shooting with the 2nd unit him novak kidd camby nd white or thomas
positive,"This looks like a nice place to spend a friday afternoon.....  Chalet of the Week, Chardon, Val d'Isere.... http://t.co/9qeINVx7"
neutral,going to do my tutorial at CL. call me when your class ends.
positive,"Marguerite the Photographer: Irish Heather, Gastown, Vancouver. Happy St. Patrick's Day everybody!!!!  (17 Mar 2012) http://t.co/Ae9xeefH"
positive,"Big 4 with Kevin, Deniesse, Devine, and Ryan sa kick off ng PBB Teen Edition 4 on Sunday, April 8 at 9pm.#excitedmuch!!!#BiggelonTV"
negative,"Pearl Jam's 2000 European tour ended in tragedy on June 30, with an accident at the Roskilde Festival in Denmark.... http://t.co/n700mcug"
positive,take care
neutral,"Former Minister &amp; SLFP member Najeeb A Majeed may appoint as CM of the Eastern Province. But, can't confirm the news still"
neutral,"early bird @TomCole24 catches the strava fail. @cyclingsam9 bosses LSCC club run sat in Spartacus flemings, wheel all day."
positive,Can't wait for ISS tomorrow.... Not but at least ill have Kenna with me
neutral,"From satellite images, it appears that Muscat may get some thundershowers tonight"
positive,"Another awesome tweetup (this time in Cebu) with a Rafa-tard! Great meeting you @scorpio1641! Thank you! See you, Monday. Zubuchon on us!!!"
positive,Fucking stoked to hang out with my girl Thalia tomorrow night. Haven't seen her in ages.
negative,but my bday is tomorrow and i have to spend it in Natchitoches away from my family&lt;&lt;&lt;&lt;&lt;&lt;&lt;&lt;&lt;&lt;&lt;&lt;&lt;&lt;&lt;
positive,LEO SEASON we still at it!!!! JETT LOUNGE this Sunday !!!!  http://t.co/4bmGPgkH
positive,@sidlowe Sanchez & Cesc are excellent additions but can't see much central def cover? Is Mascherano 3rd CB or will Pep trust the youngsters?
neutral,Yo unnu memba #AmbroZia THIS SATURDAY at Oneil's Place enuh!!!!!! Bear TingZz Production it loud!!! U hav u ticket yet?!?!?
positive,LIPA 4:19 http://t.co/tAjnLOaV beat the bad weather join us for our taster sessions wed and thurs at Joseph wright centre
neutral,"On July 24th, the trucks will make their debut at Tony Stewart's raceway Eldora Speedway! Whose looking forward to this race?"
positive,Just pre-ordered the Droid Bionic. Pick up from the Verizon store next Friday! :-) (@ Brevard NC) http://t.co/q96jCgo
neutral,Special Labor Day COOL OUT goes down TOMORROW NIGHT @ the Gin Mill 10-2
neutral,Get your ticket for a Detroit Red Wings Bus Trip on March 22nd against the Dallas Stars. http://t.co/F0oOYTEQ
negative,So I heard my old crush is going to the bell game tomorrow and wanna talk? Wtf? :o  #weird
negative,"@NeilHarmanTimes Just noticed you using the Spanish abbreviation ""NO sure"", no? Think you're missing Rafa, mon brave"
neutral,"Friday is Pi day, gonna get round on Pi day...  http://t.co/Ddch6mpb"
negative,Some of the snakiest people on the face of the planet ...
positive,TOMORROW!!!! @ForeverTheDay will be playing at the Strawberry Festival in Watsonville from 11am - 12pm! Come out and support FTD!!
neutral,Hello my Navy Yard and Coast Guard friends. Tomorrow we will be at Truckeroo. From 11am to 11pm.  @ the Fairground on Half St.
positive,Bust it Baby by Plies feat Ne-Yo was my ishhh all 8th grade year! Reminds me of my ex.... In a good way. One of the best years
positive,I know it's in January but I cant wait for The Royal Rumble #WWE
neutral,Can meet 4 dinner then chit chat a bit lor... Up 2 u lor since u already outside... Can u make e decision...
negative,Off to Scotland today for the week so I'll miss the wankfest at Wembley. Utd 2-1.
neutral,Same hall\u002c but i\u2019ll only be back in the afternoon. I need to visit my sup. Whwn will you come?
positive,"Full time. Happy days. Apologies for the tweetathon, gotta finish tomorrow's presentation now, Derby in the morning. #pizzasweats #dominos"
neutral,Could this convince you to buy? RT @iphoneplaza: Verizon May Offer Early Upgrades for Droid Bionic and iPhone 5 Buyers  http://t.co/dEOxwCW
neutral,@Antonio_Sharif @sian_cornell @saundersollie I'm starting the 30 marker in a min then I'm done ill do warners tomorrow she's long
neutral,So I just saw the commercial 4 Michael Jackson THE IMMORTAL World Tour by Cirque du Soleli is going to be here July 20 & 21 @mynameisaramie
neutral,"Talk About The History of Valentine Day: Every February 14, across the United States and in other places around the... http://t.co/9rzD99jT"
positive,Lol so excitin siah! Eh i am so sorry about the ktv leh...feel kind of bad!
