label,x_train
neutral,Get ready for our Wednesday Drink Specials Wednesday - 3-8pm Have it your Way Margarita Day  ( Bar Brand Only)... http://t.co/ml806WRT
positive,Monday already. That's OK - at Volare Restaurant Chicago we have the perfect meal waiting for you today.   We... http://t.co/fWNb7ADX
positive,Inbetweeners movie coming to cinemas in Ireland on the 19th of August. I have never wanted to see a movie so bad!! #shouldbegood ;)
positive,"@Miranda_Lambert I heard ""baggage claim"" yesterday in Nebraska!! Ready to get it on iTunes!!!"
negative,"Our Wacky Wednesday promo, is going a bit Ground Hog Day!!! I say our  Our Wacky Wednesday promo, is going a bit... http://t.co/9TFA1XnE"
negative,I can\u2019t call you guys.. I\u2019m still downloading the stuff\u002c got prob.. dunno when i can come.
negative,Hey xin... I\u2019ll b a bit late... Cos forgot to take smethg...
neutral,1st movie of the night: The Vow
positive,"@ocean331B @stevestreza If look at Nates numbers, it's due to increased chance in OH. Good O poll in FL may have helped too."
neutral,"Kevin Bacon, Paul Rudd and 8 Other Stars to Appear in Friday the 13th or Halloween Movies http://t.co/I5dEWZcy via @AMC_TV"
positive,"Eh, em...attention! True Blood is on tonight, oh yeah! Sink ur teeth into it! LOL"
negative,@verumserum Vandals in Oakland same as the night before in SF with Afghans grown in. http://t.co/hTOswj4n
positive,"Premier League Team of the Week: Van Persie makes cut for 10th time this season as Szczesny, Evans & Ashley Young star http://t.co/fVt3OB1Y"
positive,"trust me , carder knows what he is doing ."
negative,They stop filming 'The Butler' tomorrow. AND I STILL HAVEN'T FOUND ALAN RICKMAN!!!!   -explanation- he's been filming that movie here in La
neutral,Day 3 Raspberry Pi winners!! Come back tomorrow for the last chance to win 2 more! #OpenStackSummit #DreamCompute http://t.co/EB7DlYl6
neutral,"@smartkid2015 The Galaxy S III will be available in select stores this weekend, and in all MetroPCS stores and online on Monday the 22nd.-JG"
positive,Great first half for Milwaukee's last two 1st Round picks. Tobias Harris with 12 and 6 and John Henson with 14 and 6.
positive,"Glad its Friday, but I wanna go to the NCS game... no fun when there isn't anything to do.."
neutral,Q: What is the weather like in Italy in November?  And is that a good time to travel there? #Italy #weather #iPad http://bit.ly/r0yrOe
negative,"Heads up: Galaxy S II can be wiped by just clicking a link, other TouchWiz devices may also be vulnerable http://t.co/hHesGne2"
positive,"Jose Mourinho: ""We want to win the playoff, and if we win tomorrow, that's best"" #HalaMadrid"
positive,@_BaileyRobinson She sat there this morning when Levi picked up her shirt and then lifted her paw to show she wanted to wear it today lol.
negative,Give me 5 mins with Candy the dancer from Deja Vu I'm nutting on my 4th pump she that bad lol
negative,Bharatiya Janata Party (BJP) national vice-president Gopinath Munde on Sunday refuted rumours that he was going to join the Congress.
negative,"Tom Boonen has been summoned to man the polling station in Mol this Sunday. If he doesn't, he'll get fined http://t.co/zEPnatOJ"
neutral,I live pasir ris la. And now i not at home. I am in the north.
positive,World Walking Day in few more hours! See you guys at Putrajaya! I am gonna bring my camera along :) http://t.co/elgxvRe2 #fb
positive,Thanks to @us1035 Kim & I are going to the Rascal Flatts concert tonight! Thank you Tampa Bay's Best Country!!!
neutral,She may have failed the drug test for metenolone but no trace of Rohypnol or GHB were found in her sample http://t.co/HwXVx4m4
neutral,"Did you know that Doug Wead and Jeremy Richter, the short film ""Elektable"" out June 28, is going to be doing a... http://t.co/b4PuJ1c7"
negative,Aiyar hard 2 type. U later free then tell me then i call n scold n tell u.
positive,October 28th is Youth Sunday at the Upper Room Full Gospel Church! We invite you to  join us on Sundays at 11am... http://t.co/i2VLsanX
positive,Britney: Lady Gaga's here tonight. Me: WHAT? *Watches Gaga the rest of the night *  Me: Who's concert was that ? I forgot. ;D
negative,"@SiClancy didn't BR want to ship him out in the Dempsey deal? He's 6th choice at min behind LL, JA, SG, NS, JJ. Who will take Cole and co?"
positive,"This Sunday, come watch the Ravens take on the Browns, and help support the Baltimore Humane Society! CAPTAIN... http://t.co/sddQgkJg"
positive,@Ram_ananananan 1.average age of our team is 0.4 years less than yours 2. starting XI contained 4 1st team 3. we can still win the treble
positive,Knicks vs heats friday its going down
positive,The Apple Special Event Live broadcast it UP! Shutting all other apps/browsers for maximum smoothness! http://t.co/1kYh12sO
positive,Hmmm\u002c thk she\u2019s used to me forgetin everyone\u2019s bd oredi... Haha\u002c not bad \u002c ur bd got pretty gals to company...
positive,"Sept 8 las Vegas Hard Rock, Randall ""the KO King"" Bailey vs Devon Alexander. 37 year old Bailey looking good in his 4 win streak."
neutral,ATTN: There will be a candlelight vigil held for Mitch tonight at 8pm in Huntington Beach at Main St. &amp; 12th. (cont) http://t.co/o3kW2ZHp
positive,"@BBCSport #bbcsportsday c'mon guys, what about #LFC away 1-0 win at FC Gomel in #Belarus? I was there, I'm sure we won!"
positive,"Rare, 300kg meteorite discovered in Poland, biggest in Eastern Europe and may provide clues about Earth's core: http://t.co/KEp3zkLZ"
neutral,"So Halloween got moved to November 5th? That's a Monday, yeah no thnx. I'd rather just dress up as a candy cane for Christmas."
negative,and happened to see the most horrific flat I have seen in my life .
neutral,"And on the very first play of the night, Aaron Rodgers is INT'd by UDFA CB Brandian Ross, who returns it for a pick-six touchdown."
positive,12th film at #MtnFest: Winged Seduction: Birds of Paradise. This was the sexiest movie at Banff. If you think mating birds are sexy.
positive,@RosewoodOrDie By the skin of their teeth... Gregg Williams.. Easily 2nd best D Coordinator y'all ever had
positive,Got email saying my copy of Deus Ex is on it's way. If it arrives tomorrow I will literally stay up all night playing it. No joke.
negative,"Can't watch Rafa's ""I'll be back"" video til the end, it's too heartbreaking :( plus it just reminded me he was up 5/1 in AO 5th set..."
positive,No need lah. I will try again with e one i bought.
positive,Cheese curls and wine is a great bed time snack. Time for lights out before my regional day tomorrow! Haha #insidejoke #sleep #goodnight
positive,"Had a good time with student teacher, Steve Emerson today at the home brew class. Next one will be June 2nd. http://t.co/YYmfqd3c"
neutral,UFC 134: Anderson Silva vs. Yushin Okami Gambling Spotlight: A handful of UFC 134 props to make your night a lit... http://t.co/qLs3xVy
neutral,@BadmanTips commentator says Porto dominated 1st half &amp; looks that way again in the 2nd
positive,"I love Asia, she's the first friend I made down here in 7th grade."
positive,Watch ESPN tonight to see me burning @JRGessler for a sick goal on the top ten. #realbackyardFIFA
positive,@Pastorjoshg @corylethgo @KevinCabe @kcabe21 I'd watch Cougar Town over this any day! January 8 on TBS. Very funny. #firedooley
positive,Celebrity Juice tonight 10pm itv2. Hurrraaaaah! its a Back to school special
neutral,ARRIVAL of ship: SHAM Port: ABU DHABI Time: Nov 1 2012 6:27PM (UTC) (Time of arrival/departure is the time the vessel approaches ...
negative,Having so much doing linear algebra this Friday night #not #bored #yawn #math #mathhomework #linearlagebra
positive,"@Bryn2renner forget about Dook now we own that series anyways!  let's ""Beat State"" this saturday as we continue on to a succesful season."
negative,I think I may be the only person around not excited that Beyonce is the half time performer for the Superbowl.
positive,"Photo: Dr. Seuss has always been one of my favorite people. His work may have been surreal, but it always... http://t.co/ufmYYVjr"
positive,Omg. Ricky Martin may be gay but he is one fine ass gay man.
neutral,Free on this Tuesday for a business strategie?
negative,"@HStringfellow Yes, but Mothers' Day comings from Mothering Sunday, doesn't it? Whereas Fathers' Day is just a sop to stop them complaining."
neutral,Jacksonville really sound like the move tomorrow
neutral,next gigs will be 10/23 @ Pocket Sandwich Theater with Singapore Slingers and 11/7 at Bryan St. Tavern for Wed. Night Jazz with my quintet.
neutral,Today's 1st&10 debates! Did NE just win the Super Bowl getting Haynesworth? Odds Nnamdi signs w/ Jets!? Can Reggie Bush help Dolphins?
neutral,Also makes me think of doppelgangers !
negative,Austin Rivers is overrated I don't see how he came out in 1st round
neutral,Tune into @NASCARESPN for live coverage of tonight's NNS race. @KevinHarvick starts 5th in the 200-lap event. #NASCAR
positive,"OK SORRY SM Sta. Rosa, November 10! See you guys! =)"
positive,Fun date night with my girl. Home early. Ice my aching body. Wish i had Netflix right about now....
negative,All this damn work I still haven't had the chance to call Martin about these poems. I have to do it tomorrow
negative,"@justinbieber is gonna be in Louisville, Kentucky tomorrow &amp; I can't go to the show. I guess I'll just sit and listen to his music &amp; pretend"
positive,"Gut decision. Sharon Van Etten &gt; Cat Power. Elicited emotion in me like the 1st moment I heard Trespassers William, or Casimir Pulaski Day."
neutral,"Federal Reserve sticks with stimulus: The Federal Reserve made no major policy changes Wednesday, de... http://t.co/XNf6U9W6 #sanantonio"
positive,Mass gathering in a single hotel room. Mmm Chinese. And I could put up with Family Guy for one night.
positive,"@fashionablylost Penny Dreadful is a Record Breaker is out in March, just in time for World Book Day! x"
positive,remember that one time in the 4th grade when i loved The Parent Trap so much that i gave it up for Lent....
positive,"Isaiah's prayer tonight: ""...and God, thank you for all the wonderful animals you made. Like bears, lions, tigers and pterodactyls."" Love th"
positive,I\u2019m ok wif it cos i like 2 try new things. But i scared u dun like mah. Cos u said not too loud.
neutral,Irish SunSport Tuesday: Robbie Keane rallies the troops ahead of vital Faroes clash @noriordan #roi
positive,"My Heart is Gold, my Twat is glass, c'mon baby can't ya see? Yes..a glass twat..better known as a ""womb with a view"" ;D LOL!"
negative,"this nigga @OctobersOwn91 just hit a full court one handed shot with brook lopez...smh, 21st birthday shit"
positive,@EleanorC_Crew get well soon Tressa! have a nice day tomorrow :))
neutral,"You know you're in SF when, on a thurs night at 6pm, there are people lined up around the block to see Reid Hoffman."
neutral,Who wants to see Maya Rudolph sing Prince with my Thursday night
positive,Kendrick Lamar may arguably have the best hip hop album of the year in my opinion
positive,@cthreeo3 I have lots of spare jars. Marmalade is the one 'jam' G&I have not yet made. So glad u found Ash Wed easy & uplifting.
neutral,Hey\u002c can u guys make it tdy at 5pm?
neutral,Shout out to all the girls who will be taking the walk of shame into cvs tomorrow to by a plan b #dressinglikeaslutcomeswithaprice
neutral,About to watch Safe House for the 1st time... #Redbox #Latepass
neutral,Austin Rivers just scored his 1st NBA points with 6:48 left in the 4th you running with the big boys now son (my Doc Rivers voice)
negative,If you thought the London Riots were bad just wait til the Mexico City Riots break out once they get word Lopez Tonight got cancelled
neutral,Tiffany will be one of the MCs along with CNBlue's Yonghwa and Beast's Gikwang for SBS KPOP Super Concert on November 10.
neutral,RNDM has a beef with Canada. Tonight in Montreal @TheatreCorona. Tomorrow night Ottawa @AlgonquinColleg Commons Theatre http://t.co/DiGS3NOG
neutral,Eat at old airport road... But now 630 oredi... Got a lot of pple...
positive,Listening Bear McCreary Battlestar Galactica' OST makes me wanna see this amazing tvshow again. One day I'll see it for the 4th time :P #bsg
positive,"Glad to see the coaches are paying attention to their poll. Auburn, which is likely to finish 5th in SEC West, No. 19 in country?"
negative,"Krul crocked, just putting it out there Craig Gordon britains 2nd most expensive keeper is without a club? #nufc #SAFC #FTM"
neutral,l!! where is terrance he need  to cme back to the bluff should've stayed with him wednesday instead of going to turner house!! :))
positive,hollywoodcrush: 'My Super Psycho Sweet 16 Pa 3' premieres tonight! Prepare for the carnage with this clip: http://t.co/DinceXGj
neutral,In the Sports World Kenseth avoids 25-car pileup to win at Dega: Daytona 500 winner Matt Kenseth won  Sunday at ... http://t.co/5Adr4H6w
neutral,#MEDIA #US #ru Klitschko is big hit with Ukrainian voters: KIEV (AFP) - Ukraine prepared Saturday... http://t.co/7yC7rdc9 #EU #UK #Obama
neutral,err...i dun think so ler...maybe u should ask office n c how they say lor?
neutral,Clearwire Is Sought by Sprint for Spectrum: Sprint disclosed on Thursday that it had offered to buy a stake in C... http://t.co/5Ais2S9j
positive,@TNA_GUNNER Been trying to decide on a new show to watch & always get tons of Sons of Anarchy suggestions. I may go 4 it. Have a blessed day
neutral,who is going to hammond friday or today
neutral,Taking a trip to Wichita State tomorrow w/ my Little Brother. Any alumni/Wichitans with recos? #SarcasmNotWelcome
negative,"@KyleGeller10 @flybirds27 they were in 10th place and the hadn't acquired Jeff carter yet, so not quite."
negative,"May be late to the NCS thing, I honestly haven't the foggiest where the central library is xD"
positive,Tweet di Brintey So amazing to have the beautiful Lady Gaga at the show in AC tonight. Love you girl.- Britney http://fb.me/13C1kUZaw
positive,Oii @premierleague make Martin Atkinson referee for #CFC vs #MUFC clash on 28th. Thanks &lt;3
negative,"@3Sugar2Ray1: bro ""This nigga said Zimmerman was charge with a 2nd degree murder. Who he kill the 1st time?"" Lol"
neutral,victor cruz aint do the salsa ALL game...he's overdue....its the 4th quarter...its TIME
neutral,"#OnThisDay 2005 Prince Charles married Camilla Parker Bowles.  ""Well, there were three of us in this marriage, so it was a bit crowded"""
neutral,@coolzjay I have DECA pictures tomorrow too though.. what time are the pictures?
positive,I\u2019m watching Dark Angel now... very interesting! Heez I\u2019ll go to bed after the show k... if u\u2019re tired u go slp 1st.
neutral,"This is one tough , no-nonsense man !"
neutral,Hmmm... Reach there at 1? Cos my sis goin oso... U wan to go somewhere near my hse den can fetch u oso...
neutral,"Maniaci on Casimir Pulaski Day (March 1, 2004): ""Some people call it a holiday."" Judge: ""I call it a holiday."" #DrewPeterson"
neutral,"On 1 Nov: The Duke of Kent - President, will attend the Mersey Weaver District Scout Council Presentation... http://t.co/XYAORdtZ"
neutral,To go to Astrology night tomorrow or to not go to Astrology night tomorrow. That is the question.
negative,Sam Loco Efe (Nigeria Nollyhood star) is dead.  We are still mourning Christy Essien now it is Sam Loco's turn. May his soul RIP. #jhub
positive,"Monday Madness is still going strong throughout Miami! Come by Pinecrest, Coral Gables, Doral or Miami Beach... http://t.co/DLyJPkvU"
positive,Good luck to the #DunfermlineWolves players that have their Fife and Tayside trials tomorrow. Show them what you can do #itsyourtime
positive,This Saturday I'll be playing B2B with Dark-E at Sjoekoe bday bash ( Cherry Moon ). Be there!!!  Full line up:... http://t.co/z5SAnGLC
neutral,I just may be the only person who still play Temple Run
positive,"If ur going 2 #SDCC, Get 1st look at Michael Easton's new graphic novel ""Credence,"" booth no. 4401. Exciting news!"
positive,morning tweeps! i'm going to Milan today! yaay
neutral,DealBook: Clearwire Is Sought by Sprint for Spectrum - Sprint disclosed on Thursday that it had offered to buy a sta... http://t.co/CUYqpIpT
positive,@funfunfunfest is coming up this weekend!! We're super excited! Playing the Blue Stage on Sat night right before A$AP Rocky!
neutral,***Thursday night Friday night dinner special***  Salmon &amp; Jumbo Shrimp 15.95 Whole Fish (Porgie) 1.5lb with lemon... http://t.co/h10h4M8A
neutral,Coverage of high quality stakes races from The Curragh posted to my blog soon. Good value bets on offer across the UK & Ireland for Sunday.
neutral,use computer to print one yourself
positive,"Ahhhh, the sun is shining, the birds are singing and this Nirvana track I have on is bringing it down. Skipety."
neutral,#UFC @JesseSeedath Yushin Okami isn't just Anderson Silva's opponent Saturday night - he's the only... - http://t.co/pRafGi5
positive,I took my boyfriend Best virginity last night in Club Bodi...it was her 1st time goin 2 the club EVER @smokers_lane HAPPY BDAY CHUM CHUM
positive,"Working in the Bi Nam exhibition again tomorrow and photographing the new exhibition at Turner House in the eve, excited!"
positive,"I have a spare ticket for the Warners at the Bay beer festival on Sunday, anyone want it?"
negative,"RT @smartfootball: Feel bad for star crossed LionsRT @AdamSchefter: So far, WR Titus Young is the only one of the Lions top three picks  ..."
negative,Gregg Williams may never find a job in the NFL again if he's allowed back. Snitchin will make your situation worse!
neutral,"Saturday morning Goon, the kids dying to play puck"
neutral,and the 4th one is for Harry Styles!! &lt;33333
neutral,"yo. it's been 5 years since Kina Grannis wrote her song ""Cambridge"". a lot of you may know it from Wong Fu... http://t.co/jaQT4fWY"
negative,"So I'm listening to this Beatles' playlist to study for my Beatles midterm on Friday, and fucking SNSD is one of the related videos. #WTF"
negative,The Big L is strictly gunplay I run thru church n pistol whip the priest every Sunday. DAMN :|
neutral,"Come to ""Hot Jam with Suzanne"" Friday, November 9 from 11:00 am to 1:00 pm. http://t.co/j1vS47QS"
positive,@MUAthleticsTPP: Kickball tournament is on its way #MizzouSpirit http://t.co/YesQdKgj .. the tigers are coming back strong tomorrow!
positive,Panellist from World Bank presentating on Understanding the potential for youth and women and wat may help guarantee success #GCARD2 #C22
neutral,#picstitch At my 1st Phillies game watching the Knicks Vs Heat #AtTheSameDamTime http://t.co/LYgnb2Cj
neutral,As all my Subscribers may know in young and now I'm doing YoutubableHD trolling So watch my tweets for news about Open Lobby
neutral,you wan the black one or white one?
neutral,"The Fox shows watched moving onto a movie, George Clooney no thank you. I may be one of the few on the planet who has never watched Titanic"
neutral,I sitting at e back of e circle stage...
neutral,@BarackObama: I would think you would do that if you are running for POTUS. It may be part of your job someday.
neutral,Aston Villa midfielder Karim El Ahmadi will miss Saturday's trip to Sunderland through suspension following his fifth booking of the season.
neutral,Our coverage of Garner vs. Athens Drive beings tomorrow night at 6:30 on http://t.co/dBRkPMZV &amp; @tunein. Hope you'll join us!
neutral,Upcoming Saturday @ Cherry Moon:  The start of a whole new season of the harder styles: FIRST CONTACT !!  With... http://t.co/YFZ2eP3A
negative,Wish I was going to the rodeo tomorrow night with everyone :( stupid surgery
negative,Playing Jacinto on Gears3 on Guardian fer the 1st time nd its raining wth..
neutral,I still haven't started tidying my room and I'm just sat on the floor watching Project X  lol
negative,ya 'll have survived WAY worse drum majors ... no names mention .
neutral,classy RT @pwire: Boehner proposes Obama speech be on the same night as NFL opening night...  http://t.co/eALW22K
positive,"So excited about the opportunity to go listen to @drlindseyduncan speak in Knoxville, TN tomorrow night!! Looking forward to learning! :)"
neutral,"@rogbennett Hey Mr. Bennett - I just read the blog on Luker. May NC Youth Soccer reprint your article with your permission? M. Moore, DepDir"
positive,I just realized that tomorrow is Friday which means tomorrow is the Kingsburg Vs. Selma game :) #excited
positive,"Feb 13th at the Bell Center, Bon Jovi is back in MTL. Just in time for my birthday, I'm just saying :p"
positive,"@styleofsam oh, it is, tomorrow is Jason Wu fashion show!! You would LOVE!"
negative,"IEBC is ready for 4th march elections, the electoral body should not be used as an excuse to delay polls says Chairman."
neutral,The Business Leader's Award ceremony will be held during the @wef annual meeting in Davos on the  25 January 2013! http://t.co/YI4r8UFM
positive,Apple Special Event: OMG the iMac is paper thin and so gorgeous! Stunning! Thin! http://t.co/JSyBSpOz
negative,"Obma fails 2unite us, he divides us by sex, color,party,age, wealth Nevada's 1st Latino governor votes early for Romney, predicts GOP win"
neutral,RT @espn ESPN MLB Cameron Maybin starting to see the sun http://t.co/AIYSC8l
neutral,Get up to date commentary on the Medium Term Budget Policy Statement SA Budget from Deloitte tax experts #SABudget on 25 Oct Read more
neutral,"Tomorrow come and hear @DavidWillettsMP&amp;@MASieghart debate ""Navigating the new Higher Education market"" 5.30pm, Jurys Inn #CPC12"
positive,"Day 3 in the Big Brother house and it's Ingleton Waterfalls trail today, promises some amazing scenery!"
positive,Feet First has #PrincetonTec headlamps! Hope to so you all at the Young Life 5k Saturday.
negative,opss I forget to call you just now
neutral,Damn Rivergate Skate Center used 2 b the spot to b on Friday the 13th.
neutral,My dear\u002c i have finished meeting too... Now going to nuh...
neutral,"highlight of monday was chucking a mattress down the stairs which hit eleanor around the face, causing her to fall down the stairs"
positive,"@KarenChristian2 GM The new cast of DWTS is going to be on Good Morning America on Tuesday Morning, hope your appts. go well, love U!!"
neutral,Does anyone want to come with me to see Ted Nugent speak at freedom hall tomorrow. It's free
neutral,Rob on the 'Kyle and Jackie O' show on Oct 23rd: http://t.co/qznYakjw
neutral,#apple Apple's iPhone event: Join us Wednesday (live blog): The Lam Research Theater at the Yerba Buena Center f... http://t.co/5bSbJQB5
positive,"@iballindia "" #iloveiBall "" I wish kareena kapoor a very happy birthday, may this 'heroine' be blessed with national award"
neutral,#g8m Steve Emerson on SUN explains the riots and real motives http://t.co/6DfPuYP3 #tcot #teaparty
neutral,@TomCruise Prototype Quadrotor with Machine Gun! VISIT FPS Russia a 5th mission impossible film?(:  http://t.co/TGk6yEO2
neutral,&lt;3&lt;3 NIPPLES &gt;=) The Elite After Olympics Party is the place to be SATURDAY OCT 27 @ Oneil's Place!
positive,"Vincent Jackson injury update: Active on Thursday against the Vikings, fantasy owners can rest easy: Tampa Bay B... http://t.co/7POEwMOP"
neutral,@JeffMarek Perron? Really? Gagner is no comparison. Perron=1st liner Gagner=3rd liner. One 8 pt game and people forget that he is a bum????
neutral,i notice the recent one is in the month of may ..
positive,"Nicki Minaj flashes a nipple on Good Morning America, youLve gotta see it, AfgHAN SAYs So http://bit.ly/rg5jPa"
positive,@Maria20070 bitch u shoulda came with me Saturday sooooo much fun. Met Romeo santos lmao na i met his look a like
positive,"Last Tuesday we asked ""Who is the greatest England captain ever?"" and the winner is Steven Gerrard (50% of votes). 2nd place for Bobby Moore"
neutral,A script by the Coen brothers. Alan Rickman naked. Just a few of the things going for 'Gambit' (out Nov 21st).... http://t.co/18BpGAv3
neutral,Crazy I was in a meeting with an old NBA player that was picked 3rd before Larry Bird
positive,Star ships were made to flyyyy  #nowaynicki #congrats you passed 1st grade.
positive,"Bring it on!! :) RT @cinema21: Kung Fu Panda 2 will released on Tuesday, 16 August 2011"
positive,"@cocozzaHQ I preordered it on Thursday/friday at midnight the night it came able to pre-order, love you and Frankie. X http://t.co/Pp1oZZaA"
positive,"@thedlv915 how was the series, SAC 2nd gig? Love music, coz its Yoko Kanno! Cowboy Bebop music creater!"
neutral,#MariahCarey announced Australian Tour. Are you going to buy a ticket? http://t.co/7dlhd4i9 #AustralianTour #January #tickets
positive,Love this song! One of my favorites for sure. Can't wait to see you tomorrow at The Roxy! (@YouTube http://t.co/Mf5Ws9cN)
positive,Goodnight! Big day! Tomorrow I'm at the school to 3:00 (Argentina time) because I stay to the Mallin! (Tomorrow I'll tell you what is that)!
positive,The Roxy is alive with THE SOUND OF MUSIC this Sunday at 1.30pm. This is the LAST chance to see it on the big... http://t.co/VkEUlX4Y
positive,"Hey, it's Gary Carter bobblehead night when the clones come to VT on Saturday.  25 cent hot dogs and fireworks on Friday. Woohoo!"
negative,@RSElectronics No I want my Raspberry Pi which I ordered from you in July... 19 weeks dispatch time is ridiculous!
positive,Bad Girls Club: Mexico...is so official now meaning most of the girls going off on each other. I can't wait until monday.  |D
negative,"Man,I want to go fuxs with the homies @Hdashkane @ADdaCAPO @KEN2theFOOL tonite for MNF @ the #Horn but I can't:("
neutral,"#News SAIL may tie up with NFL for Rs 4,450-cr Sindri plant: ""NFL is the likely partner for SAI... http://bit.ly/oLwg8I @amitkarnani #AK"
negative,In 27 hours i know if im gonna see the boys live on May 1st!! Omgg im sooo scared for tomorrow!
neutral,Guess I'm singing 'What Makes You Beautiful' with @HeyKevinLiu tomorrow for choir #Leggo
neutral,@RissaHope12 you went to Henryville up til like 4th grade right??
